{
  "$schema": "./examples.schema.json",
  "catalog_version": "0.1.0",
  "status": "development",
  "firmware_baseline": {
    "agent": "0.6.0",
    "protocol": "PBLE/1",
    "micropython": "1.28.0",
    "source_commit": "0c7230d6708797c241160ba71fbd37e6b22f180a",
    "release_tag": "firmware-v0.6.0",
    "release_descriptor_sha256": "c2940281a14feddb55c48de15ac18087e9317d1b7130e514fab5a209b046a1e6"
  },
  "profiles": [
    "esp32-4mb",
    "esp32-s3-n16r8",
    "waveshare-esp32-s3-lcd-147b",
    "esp32-c3-4mb",
    "rpi-pico2-w"
  ],
  "examples": [
    {
      "id": "portable-hello-console",
      "title": "Hello Console",
      "summary": "Confirm import, Run, and bounded console output.",
      "planned_release": "0.1.0",
      "path": "examples/portable/basics/hello_console",
      "entrypoint": "pyble_hello_console.py",
      "files": ["pyble_hello_console.py"],
      "category": "basics",
      "level": "beginner",
      "concepts": ["console"],
      "classification": "portable",
      "designed_profiles": ["esp32-4mb", "esp32-s3-n16r8", "waveshare-esp32-s3-lcd-147b", "esp32-c3-4mb", "rpi-pico2-w"],
      "validated_profiles": [],
      "known_incompatible": [],
      "requires": {
        "modules": [],
        "capabilities": ["core-python"],
        "components": [],
        "configuration": [],
        "wiring": [],
        "app": ["Connected Files import into /examples", "Explicit Open and Run"]
      },
      "effects": {
        "pins_driven": [],
        "files_created": [],
        "output": "One greeting line.",
        "duration_seconds_max": 1,
        "cleanup": "No resources require cleanup.",
        "persistent": false
      },
      "minimum_firmware": "0.6.0",
      "protocol": "PBLE/1",
      "limits": {"source_bytes_max": 32768, "import_batch_bytes_max": 131072, "heap_bytes_max": 32768, "output_bytes_max": 4096, "runtime_seconds_max": 1},
      "validation": {"status": "planned", "host_evidence": [], "hil_evidence": []},
      "license": "MIT"
    },
    {
      "id": "portable-paced-counter",
      "title": "Paced Counter",
      "summary": "Use variables, a finite loop, and paced console output.",
      "planned_release": "0.1.0",
      "path": "examples/portable/basics/paced_counter",
      "entrypoint": "pyble_paced_counter.py",
      "files": ["pyble_paced_counter.py"],
      "category": "basics",
      "level": "beginner",
      "concepts": ["console", "loops", "pacing", "variables"],
      "classification": "portable",
      "designed_profiles": ["esp32-4mb", "esp32-s3-n16r8", "waveshare-esp32-s3-lcd-147b", "esp32-c3-4mb", "rpi-pico2-w"],
      "validated_profiles": [],
      "known_incompatible": [],
      "requires": {
        "modules": ["time"],
        "capabilities": ["core-python"],
        "components": [],
        "configuration": [],
        "wiring": [],
        "app": ["Explicit Run"]
      },
      "effects": {
        "pins_driven": [],
        "files_created": [],
        "output": "Five counter lines paced by 500 ms.",
        "duration_seconds_max": 3,
        "cleanup": "No resources require cleanup.",
        "persistent": false
      },
      "minimum_firmware": "0.6.0",
      "protocol": "PBLE/1",
      "limits": {"source_bytes_max": 32768, "import_batch_bytes_max": 131072, "heap_bytes_max": 32768, "output_bytes_max": 4096, "runtime_seconds_max": 3},
      "validation": {"status": "planned", "host_evidence": [], "hil_evidence": []},
      "license": "MIT"
    },
    {
      "id": "portable-runtime-info",
      "title": "Runtime Information",
      "summary": "Report non-identifying runtime and free-heap information.",
      "planned_release": "0.1.0",
      "path": "examples/portable/basics/runtime_info",
      "entrypoint": "pyble_runtime_info.py",
      "files": ["pyble_runtime_info.py"],
      "category": "basics",
      "level": "beginner",
      "concepts": ["runtime", "memory", "console"],
      "classification": "portable",
      "designed_profiles": ["esp32-4mb", "esp32-s3-n16r8", "waveshare-esp32-s3-lcd-147b", "esp32-c3-4mb", "rpi-pico2-w"],
      "validated_profiles": [],
      "known_incompatible": [],
      "requires": {
        "modules": ["gc", "os", "sys"],
        "capabilities": ["core-python", "gc"],
        "components": [],
        "configuration": [],
        "wiring": [],
        "app": ["Explicit Run"]
      },
      "effects": {
        "pins_driven": [],
        "files_created": [],
        "output": "Four non-identifying runtime summary lines.",
        "duration_seconds_max": 2,
        "cleanup": "No resources require cleanup.",
        "persistent": false
      },
      "minimum_firmware": "0.6.0",
      "protocol": "PBLE/1",
      "limits": {"source_bytes_max": 32768, "import_batch_bytes_max": 131072, "heap_bytes_max": 32768, "output_bytes_max": 4096, "runtime_seconds_max": 2},
      "validation": {"status": "planned", "host_evidence": [], "hil_evidence": []},
      "license": "MIT"
    },
    {
      "id": "portable-file-round-trip",
      "title": "File Round Trip",
      "summary": "Create, verify, and remove one tiny text file safely.",
      "planned_release": "0.1.0",
      "path": "examples/portable/workflow/file_round_trip",
      "entrypoint": "pyble_file_round_trip.py",
      "files": ["pyble_file_round_trip.py"],
      "category": "workflow",
      "level": "beginner",
      "concepts": ["filesystem", "cleanup", "validation"],
      "classification": "portable",
      "designed_profiles": ["esp32-4mb", "esp32-s3-n16r8", "waveshare-esp32-s3-lcd-147b", "esp32-c3-4mb", "rpi-pico2-w"],
      "validated_profiles": [],
      "known_incompatible": [],
      "requires": {
        "modules": ["os"],
        "capabilities": ["filesystem"],
        "components": [],
        "configuration": ["Create /examples and confirm /examples/pyble_example_round_trip.txt does not exist", "Do not mutate the target through Files while the run is active"],
        "wiring": [],
        "app": ["Explicit Run", "Files inspection if interrupted"]
      },
      "effects": {
        "pins_driven": [],
        "files_created": ["/examples/pyble_example_round_trip.txt"],
        "output": "Verification and removal confirmation.",
        "duration_seconds_max": 3,
        "cleanup": "With no concurrent Files mutation, removes the exclusively created and verified path; close/removal failure or changed content can leave residue.",
        "persistent": false
      },
      "minimum_firmware": "0.6.0",
      "protocol": "PBLE/1",
      "limits": {"source_bytes_max": 32768, "import_batch_bytes_max": 131072, "heap_bytes_max": 32768, "output_bytes_max": 4096, "runtime_seconds_max": 3},
      "validation": {"status": "planned", "host_evidence": [], "hil_evidence": []},
      "license": "MIT"
    },
    {
      "id": "gpio-blink-external-led",
      "title": "Blink an External LED",
      "summary": "Drive an explicitly configured external LED for finite toggles.",
      "planned_release": "0.1.0",
      "path": "examples/capabilities/gpio/blink_external_led",
      "entrypoint": "pyble_gpio_blink.py",
      "files": ["pyble_gpio_blink.py"],
      "category": "gpio",
      "level": "beginner",
      "concepts": ["gpio", "digital-output", "loops", "cleanup"],
      "classification": "capability",
      "designed_profiles": ["esp32-4mb", "esp32-s3-n16r8", "waveshare-esp32-s3-lcd-147b", "esp32-c3-4mb", "rpi-pico2-w"],
      "validated_profiles": [],
      "known_incompatible": [],
      "requires": {
        "modules": ["machine", "time"],
        "capabilities": ["machine-pin"],
        "components": ["Low-voltage LED", "Current-limiting resistor"],
        "configuration": ["Use the source guide to set LED_PIN and LED_ACTIVE_LEVEL only after an adult checks the exact board and LED circuit"],
        "wiring": ["Configured pin through resistor and LED to ground", "Shared ground"],
        "app": ["Open the source and follow its SETUP GUIDE before Run"]
      },
      "effects": {
        "pins_driven": ["Configured LED output pin"],
        "files_created": [],
        "output": "Finite LED toggles and bounded status output.",
        "duration_seconds_max": 6,
        "cleanup": "Drives the LED inactive in finally.",
        "persistent": false
      },
      "minimum_firmware": "0.6.0",
      "protocol": "PBLE/1",
      "limits": {"source_bytes_max": 32768, "import_batch_bytes_max": 131072, "heap_bytes_max": 32768, "output_bytes_max": 4096, "runtime_seconds_max": 6},
      "validation": {"status": "planned", "host_evidence": [], "hil_evidence": []},
      "license": "MIT"
    },
    {
      "id": "neopixel-single-pixel",
      "title": "Single NeoPixel",
      "summary": "Show a dim finite color sequence on an explicitly configured pixel.",
      "planned_release": "0.1.0",
      "path": "examples/capabilities/neopixel/single_pixel",
      "entrypoint": "pyble_neopixel_single.py",
      "files": ["pyble_neopixel_single.py"],
      "category": "neopixel",
      "level": "beginner",
      "concepts": ["neopixel", "loops", "cleanup"],
      "classification": "capability",
      "designed_profiles": ["esp32-4mb", "esp32-s3-n16r8", "waveshare-esp32-s3-lcd-147b", "esp32-c3-4mb"],
      "validated_profiles": [],
      "known_incompatible": [{"profile": "rpi-pico2-w", "reason": "PyBLE firmware v0.6.0 does not freeze or claim neopixel on Pico 2 W."}],
      "requires": {
        "modules": ["machine", "neopixel", "time"],
        "capabilities": ["machine-pin", "neopixel"],
        "components": ["One low-voltage WS2812-compatible pixel", "Appropriate power and protection"],
        "configuration": ["Use the source guide to set PIXEL_PIN after an adult checks the exact board, pixel, and power supply; PIXEL_COUNT stays 1 in this lesson"],
        "wiring": ["Configured data pin to pixel data input", "Shared ground"],
        "app": ["Open the source and follow its SETUP GUIDE before Run"]
      },
      "effects": {